CKG_NM,CKG_MTH_ACTO_NM,CKG_MTRL_CN
연두부샐러드,비빔, 불리지 않은 백태 물 한천가루 소금 참깨 요구르트 꿀 소금 레몬즙 
딸기견과류샐러드,비빔, 딸기 사과 귤 샐러드채소 방울토마토 아몬드 땅콩 피스타치오 딸기소스 딸기 요구르트 꿀 레몬즙 
칠리참치롤,비빔, 칠리참치통조림 밥 오이 날치알 무순 오렌지쥬스 초밥초 식초 설탕 소금 마요네즈 
콩나물곤약비빔면,비빔, 실곤약 콩나물 당근 김밥용햄 크리미 쪽파 통깨 고추장 케찹 황설탕 요리초 진간장 다진 마늘 참기름 
훈제연어롤,비빔, 밥 오이 맛살 단무지 참치캔 김밥 김 훈제연어 슬라이스 단촛물 식초 설탕 소금 참기름 날치알 와사비 마요네즈 핫소스 레몬즙 후춧가루 마요네즈 소스 마요네즈 레몬즙 
달래콩나물밥,비빔, 콩나물 달래 당근 고춧가루 진간장 다진 마늘 깨소금 들기름 참기름 대파 다진 것 
쫄면,비빔, 쫄면 콩나물 오이 당근 적양배추 삶은 달걀 고추장 고춧가루 간장 물엿 설탕 식초 참기름 다진 마늘 과일즙 
해물콩나물밥,비빔, 불린쌀 콩나물 오징어 새우 다시마 물 장 진간장 고춧가루 참기름 통깨 다진 청양고추 다진 붉은고추 다진 대파 청주 소금 
사시미곤약쫄면,비빔, 사시미곤약분말 물 보라색천연색소 토마토 양상추 삶은계란 초고추장입맛에 맞게 조절 
김치비빔국수,비빔, 소면 김치잎 깻잎 고추장 고추가루 사이다 식초 간장 설탕 다진양파 다진마늘 참기름 
닭가슴살비빔국수,비빔, 국수 양파 노랑 파프리카 빨강 파프리카 당근 닭가슴살 소금 검은통깨 국수 간장 설탕 참기름 깨소금 마늘 후추 
콩나물쫄면,비빔, 쫄면 콩나물 오이 당근 양배추 삶은달걀 고추장 간장 고춧가루 식초 설탕 참기름 물엿 사과즙 다진마늘 청양고추 
골뱅이비빔국수,비빔, 소면 골뱅이 당근 양배추 가시 오이 양파 파프리카 참기름 통깨 과일 꿀장 고추장 고춧가루 양파 청포도 복숭아 사과 벌꿀발효 식초 꿀 간장 
날치알주먹밥,비빔, 밥 날치알 김밥용김 참치캔 참치 마요네즈 깨소금 후추 실파 밥 소금 참기름 깨소금 
달래콩나물밥,비빔, 밥 콩나물 달래 당근 고춧가루 진간장 다진마늘 깨소금 들기름 참기름 대파 다진것 
비빔국수,비빔, 통밀국수 양상추 양파 피망 당근 방울토마토 실파 땅콩 초고추장
고구마옥수수샐러드,비빔, 고구마 방울토마토 빨강 피망 파란 피망 옥수수 파슬리가루 소스 마요네즈 레몬즙 
멕시칸샐러드,비빔, 닭가슴살 토마토 양상추 양파 당근 삶은 게란 홍고추 사우전아일랜드 드레싱 마요네즈 케첩 양겨자
요구르트샐러드,비빔, 적양배추보라색 양배추 사과 크랜베리 마요네즈 메이플시럽 소금 레몬즙 요구르트 
곰돌이김밥,비빔, 밥 시판 우엉조림 당근 김 흰밥 소금 참기름 백설탕 곰얼굴부분 황설탕 소금 간장 참기름 깨소금
과일샐러드,비빔, 사과 귤 양상추 플레인 요구르트 총 식초 마요네즈 머스터드 소금 레몬즙 
딸기샐러드,비빔, 딸기 양상추 채썬 양배추 치커리 옥수수콘 플레인 요거트 꿀 레몬즙 
야채비빔밥,비빔, 가리비젓갈 밥 청국장 깻잎 상추 초고추장 참기름
꼬막비빔국수,비빔, 꼬막 당근 양배추 양파 피망 국수 샐러드채소 검은깨 초고추장 고추장 고춧가루 설탕 소금 대파 다진 마늘 깨소금 올리고당 참기름 식초 
명란젓알밥,비빔, 새싹채소 맛살 부추 김 밥 명란젓 대파다진것 다진마늘 참기름 고춧가루 깨소금 
사시미곤약쫄면,비빔, 사시미곤약분말 물 보라색천연색소 토마토 양상치 계란 삶은 것 초고추장 
바나나땅콩샐러드,비빔, 바나나 방울토마토 파인애플 양상추 땅콩피스타치오 땅콩잼 듬뿍 레몬즙 꿀 피스타치오 다진 것 
전복회덮밥,비빔, 전복 상추 깻잎 치커리 양파 당근 풋고추 등의 채소 밥 설탕 식초 다진 마늘 고추장 물엿 레몬즙 참기름 통깨 
다시마비빔국수,비빔, 다시마국수 계란 토마토 상추 고추장 진간장 고춧가루 다진 마늘 깨소금 참기름 설탕 초고추장
부추강된장비빔밥,비빔, 부추 새싹새초 돈나물 현미밥 강된장 물 집된장 양파 대파 청양고추 멸치가루 다진마늘 
제육볶음도리아,비빔, 먹다남은제육볶음 밥 모짜렐라치즈 파슬리가루
참치김밥,비빔, 참치 깻잎 김 밥 맛살 단무지 우엉 등 각각 통깨 마요네즈 참기름
새싹채소강된장비빔밥,비빔, 상추 부추 새싹채소 당근 호박 통깨 올리브유 들기름 밥 우리콩된장 손질한 멸치 물 호박 양파 고추가루 새송이버섯 마늘 표고버섯가루 두부 청양고추 
비빔라면,비빔, 라면사리 송송 썬 김치 오이채 통깨 간장 고추장 설탕 참기름 다진 파 다진마늘 
곤약비빔밥,비빔, 우무틀 회곤약 물 각종채소 게살 지단 초고추장 통깨
캘리포니아롤 ,비빔, 밥 살살 날치알 체다슬라이스치즈 단무지 크래미맛살 오이 깻잎 배합초 식초 설탕 소금 소스 마요네즈 허니머스터드 소스 
비빔라면,비빔, 라면사리 잘익은 김치 오이채 통깨 달걀 간장 고추장 설탕 참기름 다진마늘 
콘샐러드,비빔, 스위트콘 통조림 양파 청피망 작은것 홍피망 작은것 당근 마요네즈 식초 설탕 소금 후추가루 파슬리 
비빔메밀소바,비빔, 양배추 오이 양파 당근 메밀면 계란 게맛살 소스 쯔유 와사비 무 청고추 홍고추 쪽파 와사비
훈제오리초밥,비빔, 훈제오리 뜨거운밥 김밥용 김 고추냉이 머스터드 밥 식초 설탕 소금 
회덮밥,비빔, 냉동상어 상추 무순 당근채 느타리버섯 고추장 식초 레몬즙 사이다 올리고당 다진마늘 통깨 
쫄면,비빔, 라면면발만 사용 각종 야채당근깻잎오이상추양파 고추장 고춧가루 식초 설탕 매실액 다진마늘 참기름 
나물비빔밥,비빔, 밥 고사리 콩나물 계란 오이 당근 느타리버섯 묵 고추장 간마늘 간생강 양파 소금 진간장 사골육수 올리고당 설탕 참깨 사이다 
국수,비빔, 소면 신김치 레디쉬 오이 깻잎 적채 미나리 깨초장 참깨 식초 진간장 설탕 청주 멸치육수 참기름 
도토리묵말이,비빔, 도토리묵 알타리김치 오이 알타리김치 설탕 참기름 통깨 오이 단촛물 물 소금 설탕 식초 장 홍고추 청양고추 다진대파 진간장 설탕 다진 마늘 참기름 통깨 
김치비빔국수,비빔, 잘익은김치 국수 고추장 물엿 식초 사이다 참기름 깨
콩나물밥,비빔, 밥 콩나물 물 식용유 간장 고춧가루 미림 참기름 깨소금 다진마늘 다진파
육회비빔밥,비빔, 우둔살 배 설탕 청양고추 새싹 쌈야채 쌀밥 고추장 육회 장 기준 다진마늘 소금 설탕 참기름 깨소금 
참치롤,비빔, 밥 깻잎 상추 단무지 크래미 김 밥이랑 검정깨 통깨 참치 마요네즈 후추 
무밥,비빔, 채썬무 쌀 다시마 물 간장 국간장 다진파 고춧가루 참기름 깨소금 
마카로니메추리알샐러드,비빔, 마카로니 삶은메추리알 잣 호두 마요네즈 설탕 흰후추 허니머스타드소스 
골뱅이비빔면,비빔, 골뱅이 소면 오이 대파 양파 청양고추 김치 골뱅이 국물 고추장 고운 고춧가루 물엿 설탕 식초 다진 마늘 참기름 통깨 단촛물
비빔냉면,비빔, 냉면사리 무 오이 삶은 달걀 참기름 통깨 배 양파 다진 마늘 다진 생강 진간장 국간장 설탕 물엿 맛소금 포도당 구연산 참깨 고운 고춧가루 
스테이크비빔밥,비빔, 쇠고기 목심 파프리카 깻잎 새싹 비빔장 고추장 매실조청 맛술 식초 마늘 깨 고기밑간 다진마늘 간장 맛술 후추 월계수잎
후리가케참치주먹밥,비빔, 밥 참치 후리가께 마요네즈 참기름 
소라무침쫄면,비빔, 쫄면 소라 당근 오이 양배추 적채 계란 고추장 설탕 식초 다진 양파 다진 마늘 청양고추 간장 물엿 고운 고춧가루 통깨 
돌솥비빔밥,비빔, 밥 약고추장 듬뿍 당근 무 애호박 콩나물 건표고버섯 계란 소금 참기름 다진 마늘 
김치비빔국수,비빔, 국수 김치 통배추 삶은계란 고추장 설탕 올리고당 참기름 통깨 
비빔야채묵국수,비빔, 도토리묵 배추 오이 당근 깻잎 고추장 매실액기스 올리고당 식초 참기름 참깨 검은깨 
콘샐러드,비빔, 피망 양파 옥수수 적파프리카 생크림 마요네즈 흰후추 설탕 
비빔만두,비빔, 만두 양배추 오이 양파 식용유 초고추장 고추장 요리당 식초 고춧가루 
새싹비빔밥,비빔, 밥 새싹 큰거 작은거 계란 양파 새송이버섯 쇠고기 고추장 설탕 다진 마늘 참기름 후추 
베이컨달걀야채비빔밥,비빔, 참나물 부추 미나리 배추 무 당근 오이 적양배추 달걀 베이컨 김밥용김 참기름 검은깨 고추장 간장 식초
김치비빔국수,비빔, 국수 김치 오이 고추장 수북히 올리고당 식초 참기름 스푼 통참깨 
김치비빔국수,비빔, 소면 잘익은 김치썬거 정도 삶은달걀 고추장 요리당 참기름 간장 깨소금 식초 
소세지야채비빔우동,비빔, 무 오이 당근 적양배추 홍파프리카 노랑파프리카 미나리 오리소세지 우동면 초고추장 고추장 간장 다진마늘 매실액기스 식초 꿀 참기름 검은깨
두부비빔밥,비빔, 돼지고기 두부 김치 밥 고추장 다진마늘 간장 후추 꿀 설탕 깨소금 참기름 
김치비빔국수,비빔, 국수 포기김치 대파 배 계란 꼬막 소금 볶음 고추장 고추가루 매실즙 깨소금 참기름 
콩나물비빔밥,비빔, 콩나물 갈은 소고기 양파채 잔파 다진마늘 간장 꿀 고춧가루 깨소금 참기름 잔파
김치비빔국수,비빔, 소면 오이 김치 고추장 식초 설탕 고추장 올리고당 간장 참기름 깨 
상추비빔밥,비빔, 상추 양파 슬라이스 청양고추 간장 고운고추가루 간마늘 참기름 깨소금 매실즙 설탕
새우브로콜리계란말이주먹밥,비빔, 브로콜리 맛살 새우 계란 밥 간장
간장비빔국수,비빔, 국수면 후리가케김가루깨소금 간장 올리고당 참기름
김치비빔면,비빔, 국수 김치 메추리알 참기름 국수 고추장 케첩 매실청 다진마늘 김치 깨소금 참기름 설탕 
야채비빔밥,비빔, 콩나물 무 당근 상추 배추 부추 김자반 밥 저염간장 고춧가루 다진마늘 식초 황설탕 참기름 참깨 고추장
김치콩나물밥,비빔, 불리지 않은 쌀 돼지고기 간장 참기름 통깨 간마늘 후춧가루 달래장 달래 간장 참기름 고춧가루 통깨 
비빔국수,비빔, 소면 송송썬김치 채썬오이 채썬양파 김가루 김치 밑간 설탕 깨소금 참기름 장 고추장 간장 사과식초 설탕 매실액 참기름 깨소금 후추 
비빔어묵당면,비빔, 맛살어묵 당면 부추 배추 멸치육수 간장 장 다진쪽파 대파 다진마늘 다진 청양고추 저염간장 국간장 고춧가루 참기름 참깨
간장비빔국수,비빔, 소면 계란 호박 양파 당근 오일 참기름 소금 간장 요리당 참기름 깨소금 
고추장누룽지밥,비빔, 밥 참치통조림 달래 참기름 고추장 
닭가슴살치즈주먹밥,비빔, 닭가슴살 통조림 치즈 후리카게
참치버섯샐러드,비빔, 느타리버섯 캔참치 작은것 대파 올리브유 통깨 소금 
김치햄주먹밥,비빔, 밥 묵은지 후리가케 슬라이스햄 간장 참기름 소금 후추 허니머스타드 토마토케첩 
게살치즈롤샌드위치,비빔, 식빵 크래미 슬라이스치즈 허니머스타드소스 후추 소금 토마토케첩 
소고기콩나물비빔밥,비빔, 콩나물 쇠고기 당근 밥 고기 간장 청주 다진 마늘 설탕 후춧가루 간장 간장 맛술 다진 파 다진 마늘 다진 풋고추 다진 홍고추 고춧가루 참기름 통깨 
돌나물비빔국수,비빔, 소면 돌나물 고추장 식초 참기름 검정깨 아가베시럽 다진마늘 
파프리카샐러드,비빔, 돌나물 파프리카 플레인 요구르트 사과식초 다진 양파 올리고당 소금 
치즈김밥,비빔, 각종나물들 스팸 김치 치즈 밥 김밥용김 참기름 깨소금 
비빔군만두,비빔, 군만두 상추 대파 올리브유 통깨 고춧가루 식초 소금 설탕 
쌈장,비빔, 다진마늘 볶은호박씨 볶은 해바라기씨 검은통깨 참기름 아가베시럽 물엿 콩가 들깨가루루 시판용쌈장 된장 고추장 
참치새싹비빔밥,비빔, 밥 참치 새싹채소 두부 약고추장 
신김치비빔국수,비빔, 익은김장김치 참기름 깨 소면 사과 고추장 고추가루 식초 설탕 올리고당 다진마늘또는 마늘소스 깨 물 
김치비빔국수,비빔, 상추 오이 깻잎 신김치 소면 참기름 깨소금 통깨 과일즙 소스 고추장 고춧가루 간장 오렌지즙 레몬즙 물엿 설탕 다진마늘 
차돌박이비빔국수,비빔, 소면 상추 양파슬라이스 얇게 차돌박이 페퍼시즈닝 고추장 간장 설탕 식초 참기름 깨소금 후추 
삼각김밥,비빔, 밥 김치 호두멸치조림 밥 밑간 참기름 통깨 소금 김치 밑간 참기름 설탕 깨소금
봄나물비빔밥,비빔, 밥 나물류원하는종류대로 계란 프라이 불고기 비빔장
참치샌드위치,비빔, 참치 캔옥수수 오이씨부분 제거 식빵 마요네즈 후추 소스 허니머스터드 홀그레인머스터드 꿀 
크래미샐러드,비빔, 크래미 사과 베이비샐러드 레몬 올리브유 사과식초 꿀 소금 후추 
블루베리요구르트,비빔, 아이스블루베리 플레인요구르트 베리시럽
쭈꾸미달래돌솥비빔밥,비빔, 쭈꾸미 작은크기 달래 칵테일새우 호박 당근 달걀 밥 포도씨유 참기름 소금 달래고추장 달래 고추장 매실청 맛술 올리고당 다진마늘 통깨
오디샐러드,비빔, 오디 양상추 토마토 계란 키위 자몽 플레인요구르트 
버섯밥,비빔, 쌀 적은 다시마 사방 물 느타리버섯 쪽파 베이비야채 간장 다시마물 미림 설탕 참기름 통깨 간마늘 실파 
비빔만두,비빔, 당면 부추 밀가루 물 식용유 양배추 깻잎 당근 양파 밀병 간장 설탕 깨소금 참기름 초고추장 고추장 설탕 식초 사이다 물엿 통깨 마늘
깍두기비빔밥,비빔, 흑미밥 깍두기 실파 김가루 깍두기국물또는 고추장이나 장조림 간장소스 참기름 통깨 
호박나물비빔밥,비빔, 말린 호박 물 참기름 일반간장 파 소금 다진마늘 숟가락 달래간장 간장 참기름 설탕 깨소금 고춧가루 
월넛스프레드,비빔, 호두분태 해바라기씨 서울우유 끼리 꿀 계피가루 
오징어젓비빔밥,비빔, 밥 오징어젓 쌈야채 통깨 참기름 
참치회덮밥,비빔, 밥 꽃 상추 깻잎 양파 당근 풋고추 참치 무순 참기름 통깨 고추장 장 고추장 물엿 식초 설탕 다진마늘 레몬즙 매실 액기스 
곤약비빔국수,비빔, 열무 실곤약 식초 고춧가루 까나리액젓 식초 국간장 마늘 참기름 설탕 매실액 통깨 
열무비빔국수,비빔, 국수 열무김치 오이 검은깨 고추장 매실액 참기름 고춧가루 
두릅비빔밥,비빔, 밥 두릅 달걀 오이 당근 포도씨유 소금 약고추장 돼지고기 소고기 고추장 올리고당 다진마늘 맛술 후추
김치비빔국수,비빔, 김치 소면 애호박 새송이 버섯 설탕 소금 참기름 깨소금 김 식초 초고추장 
비빔면,비빔, 소면 토마토 양파 피클슬라이스 옥수수 통조림 소금 토마토소스 칠리소스 핫소스 마요네즈 피클즙 
새싹채소비빔밥,비빔, 새우살 밥 새싹채소 베이비채소 무순 클로버 적양배추싹 참기름 초고추장 고추장 설탕 식초 다진 마늘 통깨 
간장비빔국수,비빔, 국수 소고기 다짐육 표고버섯 오이 목이버섯 지단 소금 소고기 밑간 간장 설탕 참기름 마늘 소주또는 청주 후추 간장 설탕 참기름 통깨 
불고기김밥,비빔, 밥 새싹채소 계란 당근 볶은불고기 김밥용김 소스 고추장 레몬즙 식초 설탕 작은술 마요네즈 
비빔쫄면,비빔, 쫄면이나 국수 양배추 오이 콩나물 당근 달걀 통깨 참기름 취향껏 사과 초고추장 소스 설탕 식초 사과 간 것 다진 마늘 고추장 참치진국 
열무비빔국수,비빔, 소면 열무김치 통아몬드 고춧가루 고추장 설탕 통깨 매실액 다진파 다진마늘 참기름 
날치알비빔밥,비빔, 달걀노른자 당근 오이 밥 날치알 소금 참기름 검정깨 기름 
참치새싹샐러드,비빔, 양상추 새싹채소 샐러드채소아무거나 방울토마토 올리브 오일 발사믹식초 다진 마늘 유기농 꿀 소금 작은술 바질 잎 
떡비빔라면,비빔, 사리면 참기름 떡 집에있는채소파프리카양파양배추등 참기름 떡 간장 후추가루 참기름 고추장 매실청 올리고당 다진마늘 다진파 참기름 깨소금 
삼겹살비빔면,비빔, 소면 삼겹살 약 양파 상추 깻잎 오이 고추장 고춧가루 식초 설탕 매실엑기스 물 
골뱅이비빔국수,비빔, 오이 당근 골뱅이 대파 양파 생소면 참기름 상추 고추장 고춧가루 설탕 식초 깨소금 간장 다진마늘 골뱅이국물 소금 단촛물 설탕 식초 소금 
쇠고기새싹비빔밥,비빔, 다진 쇠고기 새싹채소 밥 통깨 고기 간장 맛술 다진 마늘 후춧가루 꿀고추장 고추장 식초 꿀 배즙 양파즙 다진 마늘 깨소금 참기름 
간장비빔국수,비빔, 소면 소고기 표고버섯 오이 달걀 간장 설탕 참기름 표고고기 간장 참기름 설탕 깨 소금 파 마늘 
훈제오리비빔국수월남쌈,비빔, 소면 라이스페이퍼 훈제오리 양파 노랑파프리카 빨강파프리카 피망 오이 고추장 고춧가루 식초 설탕 매실엑기스 물 
냉비빔모밀,비빔, 모밀면 양파 노랑 파프리카 빨강 파프리카 상추 오이 양상추 당근 간장 올리고당 식초 검은깨 
백김치지라시초밥,비빔, 백김치 현미밥 오이 달걀 당근 날치알 새싹 백김치 참기름 설탕 통깨 배합초 식초 설탕 레몬즙 소금 
새싹채소비빔밥,비빔, 멥쌀 새싹채소 당근 애호박 식용유 다진 마늘 소금 물 참기름 약고추장 돼지고기 다짐육 고추장 양파 다진 마늘 맛술 후춧가루 식용유 
새싹열무비빔밥,비빔, 상추 오이 새싹 밥 통깨 열무김치 고추장 고추가루 작은술 참기름 다진마늘 매실액기스 식초 설탕 
비빔냉면,비빔, 냉면 시판물냉면육수 무 물 간장 생강 큰거 사과 배 양파 고춧가루 황설탕 사이다 마늘 다진파 올리고당 소금 참기름 
파프리카비빔국수,비빔, 소면 양파 파프리카 상추 깻잎 고추장 고춧가루 식초 물엿 다진청양고추 다진 마늘 깨 참기름 몇방울
비빔만두,비빔, 닭고기 애호박 두부 파 감자전분 미나리 오이 당근 상추 적양배추 양배추 비빔 장 고추장 간장 매실청 참기름 깨소금 다진마늘 식초 닭고기 밑간 간장 집간장 참기름 깨소금 다진마늘 후추
야채비빔만두,비빔, 냉동군만두제품 식용유 골드키위 방울토마토 참외 오이 양배추 당근 깻잎 미나리 부추 파프리카 슬라이스아몬드 삶은달걀 초고추장
열무김치비빔국수,비빔, 열무김치 익은김치 소면 고추장 간장 식초 설탕 또는 올리고당 참기름 통깨 
해삼내장비빔밥,비빔, 밥 고도와다 다진파 김가루 통깨 참기름 
참치쌈장,비빔, 참치캔 양파 다진 애호박 청양고추 멸치다싯물 된장 고추장 다진마늘 다진파 
야채비빔만두,비빔, 당면 만두 양배추 적채 노랑파프리카 빨강파프리카 오이 아삭이상추 달걀 장 고추장 고추가루 간장 매실청 물엿 식초 참기름 다진마늘 통깨 소금 후추 
참치비빔밥,비빔, 참치 당근 오이 깻잎 콩나물 고추장 정종 매실청 물엿 
비빔국수,비빔, 소면 양배추 적색양배추 깻잎 오이 새싹채소 파프리카 굵은소금 장 고추장 진간장 매실엑기스 식초 설탕 참기름 다진마늘 
메밀비빔국수,비빔, 쓴메밀면 김장김치 삶은 달걀 장 고추장 매실즙 올리고당 식초 다진마늘 술 통깨 참기름 
멍게비빔밥,비빔, 멥쌀 멍게 깻잎 오이 당근 소금 고추장 매실청 식초 통깨 참기름 
알밥,비빔, 밥 날치알 신김치 단무지 우엉조림 맛살 김가루 참기름 식용유 통깨 
참치마요주먹밥,비빔, 참치캔 밥 다진양파 당근 브로콜리 오이피클 달걀노른자 통깨 소금 후추 참기름 
멍게비빔밥,비빔, 멍게 당근 상추 깻잎 오이 양배추 적채 홍고추 고추장 설탕 물엿 식초 레몬즙 발효겨자 다진 마늘 다진 생강 깨소금 참기름 
참치유부초밥,비빔, 밥 참치캔 오이 양배추 양파 깻잎 시판유부초밥 밥 마요네즈 후추가루
비빔쫄면군만두,비빔, 쫄면 상추 오이 당근 깻잎 양배추 고추장 고춧가루 식초 레몬즙 매실청 물엿 간장 다진마늘 참기름 깨소금 
꼬막비빔국수,비빔, 꼬막 양파 깻잎 당근 오이 국수 고춧가루 식초 설탕 고추장 간장 다진파 다진마늘 꿀 참기름 깨소금 
비빔국수,비빔, 소면 새싹 고추장 간장 매실액 올리고당 식초 참기름 
전복비빔냉면,비빔, 냉면 애기 전복 개 다진 잣 새싹 조림장 비율 물 간장 설탕 마늘즙 생강즙 참기름 무 오이 절임 비율 식초 소금설탕 장 비율 양파 개 사과 개 마늘 쪽 고추가루 고추장 꿀 식초컵 매실청 컵 설탕 소금 연겨자 
나물비빔밥,비빔, 고사리 당근 표고 도라지 취 시금치 콩나물 달걀 표고가루 식용유 참기름 매실엑기스 다진마늘 간장 소금 고추장 매실엑기스 참기름 땅콩분태 
비빔칼국수,비빔, 칼국수면 양파 김치 고추 고추장 매실청 마늘다진것 후추 깨소금 연두 참기름
떡갈비김밥,비빔, 시판떡갈비 시금치나물 김치 깻잎 단무지
간장나물비빔밥,비빔, 나물 달걀 밥 간장 참기름 통깨
과일비빔국수,비빔, 소면 호박 생표고버섯 단감 사과 소금 참기름 검정깨 표고버섯 간장 설탕 참기름 다진마늘 
도토리묵샐러드,비빔, 상추 도토리묵 진간장 설탕 식초 레몬즙 올리브유 후추 들깨가루 
단호박고구마과일샐러드,비빔, 단호박 고구마中 귤 양상추 넉넉히 파프리카 석류알 소스 레몬즙 소금 플레인 요구르트 프렌치드레싱 프렌치드레싱 레몬즙 샐러드오일 식초 설탕또는 꿀 머스터드소스 소금 양파 다진것 오이피클 다진것 
비빔냉면,비빔, 냉면사리 무 오이 삶은 달걀 장 참기름 통깨 장 배 양파 다진 마늘 다진 생강 진간장 국간장 설탕 포도당 구연산 물엿 맛소금 참깨 고운 고춧가루 단촛물 식초 설탕 소금 
시래기밥,비빔, 쌀 썰어놓은 시래기 시레기밥 들기름 참치액 다진마늘 육수 간장 국간장 다진 양파 다진파 깨소금 참기름 
비빔국수,비빔, 소면 오이 사과 치커리 양배추 천일염 고추장 고춧가루 매실청 올리고당 식초 다진마늘 천일염 통깨 참기름 
삼색꼬마김밥,비빔, 밥 데친시금치 당근 달걀 소금 포도씨유 통깨 참기름 김밥용김 시금치무침 다진마늘 참기름 소금 참기름
삼색주먹밥,비빔,카레주먹밥 다진 당근 다진 양파 다진 피망 밥 식용유 단무지 주먹밥 다진 단무지 밥 날치알 주먹밥 날치알 밥 카레 주먹밥 카레 파슬리가루 단무지 주먹밥 매실청 소금 깨소금 시치미 날치알 주먹밥 소금 참기름 검정깨 
참치덮밥,비빔, 밥 참치 통조림 상추 껫잎 무순 새싹채소 김 고추장 설탕 큰술 마늘 참기름 사이다 식초 큰술 통깨 소금 
명엽채주먹밥,비빔, 밥 명엽채 김밥용김 마요네즈 허니머스타드 간장 물엿 후리가케 포도씨유 다진마늘 참기름 통깨 
수삼야채샐러드,비빔, 수삼 치커리 새싹채소 노랑파프리카 빨강파프리카 닭가슴살 메추리알 사과 유자청 꿀 우스터소스 와사비 마요네즈 
양상추간장비빔국수,비빔, 소면 한줌 하고 더 양상추 정도 달걀 설탕 다진파 다진양파 식초 간장 통깨 다진마늘 참기름 
닭가슴살야채비빔라면,비빔, 라면 닭가슴살 통조림 쌈채소 간장 설탕 깨소금 다진마늘 참기름 고춧가루 
김치비빔국수,비빔, 소면 김치 오이 삶은 달걀 고추장 매실청 설탕 참기름 참깨 
대게채소비빔밥,비빔, 대게 기준 밥 새싹채소 무순 상추 김가루 고추장 참기름 
김치메밀비빔국수,비빔, 메밀면 김장김치 고추장 진간장 매실액 올리고당 식초 다진마늘 통깨 참기름 
