CKG_NM,CKG_MTH_ACTO_NM,CKG_MTRL_CN
오징어비빔칼국수,비빔, 칼국수면 표고버섯 오징어 대파 청양고추 전분 가루 간 깨 참기름 물 간 멸치 고추장 고춧가루 까나리액젓 진간장 다진 마늘 
치킨마요초밥,비빔,치킨마요초밥 남은치킨 마요네즈 소금 후추 레몬즙 볶음김치참치초밥 야채참치캔 볶음김치 마요네즈 오이마끼 오이 밥 식초 설탕 소금 
꼬막전복장비빔밥,비빔, 전복장 삶은꼬막 양파절임 전복장 표고 전복장 파 밥 버터 김가루 계란 비율 양파절임간장 전복장간장 청양고추 통깨 
간장연어장덮밥,비빔, 밥 연겨자 홀스래디쉬 소스 간장연어장 연어 정도 참기름 새싹채소 
냉메밀소바,비빔, 간장연어장 연어 간장연어장 육수 메밀국수면 조미김 무 두께 쪽파 생략가능 연겨자 홀스래디쉬 소스 
샐러드파스타,비빔, 스파게티면 혹은 크기의 양 파프리카 오이 견과류 옥수수캔 치즈가루 토마토페스토 올리브오일 마늘 바질가루 소금 
쟁반비빔막국수,비빔, 메밀국수 깻잎 상추 당근 양배추 파프리카 닭가슴살 장 고추장 고춧가루 식초 설탕 올리고당 다진마늘 참기름 통깨 
무굴밥,비빔, 무 느타리버섯 굴 달래 고추가루 매실청 들기름 
오돌뼈주먹밥,비빔, 오돌뼈볶음 밥 단무지 참기름 통깨 구운김 상추 
콥샐러드,비빔, 청포도 딸기 단감 블루베리 통조림옥수수 알배추 참깨소스 참깨 검은깨 꿀 마요네즈 식초 소금 물 
삼겹살비빔국수,비빔, 삼겹살 상추 김치 먹을만큼 삶은계란 소면 고추장 고춧가루 간장 설탕 다진마늘 참기름 
포테이토에그,비빔, 계란 감자 마요네즈 소금 후추 파슬리 슈거파우더 계란삶을때 천일염 식초 
장조림버터비빔밥,비빔, 장조림 장아찌류 단무지다진것 버터 계란 우유 소금 장조림 밥 
비빔밥,비빔, 마른표고버섯 시금치 고사리 숙주 토란대 고춧잎 갈빗살 국간장 간장 다진마늘 설탕 통깨 참기름 비빔장 계란
비빔만두,비빔, 배추 사과 냉동 만두 다진마늘 케첩 핫소스 간장 매실청 올리고당 식초 갈은 깨 
토마토비빔밥,비빔,필수 방울토마토 부추 상추 양파 밥 진간장 고춧가루 식초 다진 마늘 매실액 참기름 통깨 
비빔칼국수,비빔,필수 칼국수면 대파 건멸치 청양고추 액젓 진간장 다진 마늘 물 고추장 굵은 고춧가루 
스팸비빔밥,비빔, 스팸 김가루 참기름 통깨 솔솔
부추꼬막비빔밥,비빔, 밥 꼬막 영양부추 꼬막무침 다진마늘 참기름 소금 통깨 비빔밥 장 고추장 고춧가루 간장 올리고당 다진마늘 참기름 통깨 
유부쫄면,비빔, 쫄면 유부 국간장 맛술 소금 고춧가루 톡톡 후추 톡톡 대파 육수 멸치 디포리 건새우 다시마
비빔된장,비빔, 양파 小 애호박 두부 소고기 참기름 물 된장 다진마늘 고춧가루 물엿 
꼬막비빔밥,비빔, 양파 계절어보큰꼬막 간장 설탕 고추가루 깨소금 까나리액젓 참기름 다진마늘 
과일샐러드,비빔, 사과 배 단감 딸기 귤 건포도 아몬드 삶은계란 소스 설탕 소금 마요네즈 
김치알밥,비빔, 밥 날치알 상추 잘게썬 김치 김밥단무지 김가루 김치들기름 설탕 참깨 고춧가루 뚝배기바닥에바르는용도 들기름 
회덮밥,비빔, 회 상추 샐러드채소 오이 고추 양파 통마늘 밥 초고추장 참기름 
과카몰리,비빔, 아보카도 토마토 양파 레몬즙 소금 후추 
비빔밥,비빔,고사리나물 불린고사리 소고기 국간장 다진마늘 참기름 시금치나물 시금치 다진마늘 국간장 참기름 도라지나물 도라지 다진마늘 참기름 국간장 숙주나물 숙주 참기름 다진마늘 맛소금 무생채 무 고춧가루 식초 다진마늘 설탕 맛소금 
무밥,비빔, 흰쌀 무 표고버섯 달래 양파 당근 고춧가루 간장 올리고당 통깨 들기름
비빔당면,비빔, 당면 양파 당근 선택 부추 달걀 어묵 콩나물 단무지 고추장 고춧가루 진간장 매실액 올리고당 다진 마늘 식초 참기름 통깨 계량 
비빔당면,비빔, 당면 양배추 당근 양파 만두 초고추장 고추장 설탕 깨 참기름 
비빔밥,비빔, 양파 시금치 버섯 파프리카 당근 애호박 상추 소고기 다진마늘 배즙 진간장 설탕 맛술 후추 제육 배즙 고추장 설탕 진간장 다진마늘 맛술 고춧가루 밥육수 다시멸치 다시마 시금치무침 국간장 다진마늘 참기름 참깨 후추 고추장 고추장 매실액 참기름 다진마늘 진간장 통깨 
한치회덮밥,비빔, 한치회 밥 청양고추 깻잎 오이 양파 배 무순 초고추장 고추장 김가루 참기름 통깨
콩나물사과비빔국수,비빔, 국수 양파 오이 각 깻잎 장 계란 콩나물 사과 방울토마토 청양고추 파 마늘 다진것 간장 고추장 고춧가루 참기름 식초 설탕 깨소금 
시래기비빔밥,비빔, 시래기 삶은 것 불린 쌀 들깨가루 들기름 달래장 간장 맛술 달래 고춧가루 다진마늘 깨소금 참기름 
나물비빔밥,비빔, 호박나물 무나물 취나물무침 유채나물무침 시금치나물 표고버섯볶음 불고기 달걀후라이 고추장 참기름 통깨 
소고기잡채,비빔, 소고기 정도 당면 크게 버섯 양파 당근 호박 파프리카 시금치 계란 소고기밑간 간장 설탕 참기름 다진마늘 후추 마더소스 간장 참기름 배 양파 다진마늘 후추 설탕 
불고기비빔밥,비빔, 불린 쌀 멸치 다시마 육수 소고기 시금치 상추 파프리카 양파 애호박 당근 달걀 양송이 참기름 고기 밑간 배즙 간장 설탕 맛술 다진 마늘 후추 시금치 밑간 국간장 깨 참기름 다진마늘 고추장 간장 원하는만큼
아보카도명란덮밥,비빔, 아보카도 계란 조미김 명란젓 참기름 부 청양고추 다진마늘 참기름 깨소금 
비빔국수,비빔, 기준입니당 소면 김치 삶은달걀 상추 고추장 진간장 설탕 고춧가루 참기름 통깨
김치말이비빔국수,비빔, 소면 찬물 간장 설탕 고추가루 고추장 김치 종이컵 참기름 김 오이 삶은계란 
새싹비빔밥,비빔, 오징어 새우 파 양파 애호박 두부 청양고추 홍고추 다진마늘 육수 맛술 된장 고추장 설탕 새싹채소 
김치국수,비빔, 묵은지 조미김 고춧가루 묵은지 고추장 고춧가루 참기름 설탕 깨소금 김치국물 식초 
쿠스쿠스,비빔, 쿠스쿠스 양파 아보카도 방울토마토 레몬 야채가루스톡야채육수 소금 후추 세 꼬집 올리브오일 파슬리가루 생략가능 병아리콩 그린올리브 생바질 잎 
오징어콩나물비빔밥,비빔, 오징어 깻잎 어린잎 채소 콩나물 당근 달걀 밥 통깨 장 고추장 고춧가루 매실액 설탕 찐 마늘 참기름 
골뱅이소면,비빔,골뱅이소면 골뱅이 오이 소면 골뱅이소면 고추장 매실액 식초 설탕 물엿 간장 고추가루 
비트콩나물밥,비빔, 콩나물 비트 간장 부추 양파 다진마늘 고춧가루 깨소금 참기름 매실청 
무나물볶음비빔밥,비빔, 무 소금 토하젓 반 부순 검은깨 참기름 밥 있은면 썰은 대파 
비빔국수,비빔, 메밀면 오이 김치 스팸 계란 고추장 고추가루 식초 올리고당 참기름 깨소금 
파채비빔만두,비빔, 군만두 대파 식용유 파채 고추장 고춧가루 식초 맛술 올리고당 다진 마늘 스위트 칠리소스 참기름 통깨 
비빔국수,비빔, 면 양파 김치 깻잎 고추장 간장 고추가루 설탕 매실액기스 식초 올리고당 참기름 
비빔칼국수,비빔, 우리밀 계란 물 소금 오이 사과 깻잎 상추 당근 양파 장 고추장 매실액 설탕 다진 마늘 식초 고춧가루 통깨 
아보카도명란비빔밥,비빔,기본 밥 아보카도 및 추가 저염 명란젓 달걀 식용유 조미김 참기름 와사비 통깨 
열무비빔국수,비빔, 소면 크기의양 열무김치 오이 양파 당근 장 고추장 식초 간장 올리고당 다진마늘 참기름 통깨 생략가능 양배추 홍고추 
회덮밥,비빔, 회 싱싱한 야채들 날치알 흰 밥햇 덜된 초고추장 취향껏 참기름 취향껏 통깨 솔솔
알샐러드,비빔, 삶은 계란 양파 송쏭 썬 고추피클 마요네즈 씨겨자 올리고당 허브솔트 파슬리가루 
쌈장,비빔, 된장 고추장 참기름 올리고당 다진마늘 혹은 마늘가루 
오색비빔밥,비빔, 애호박 양파 당근 양배추 표고버섯 고기산적 쌈채소 소금 고추장 참기름 통깨 달걀후라이 
아보카도명란비빔밥,비빔, 아보카도 계란 명란 김가루 밥 
깍두기비빔국수,비빔, 소면 채썬 김치 채썬 깍두기 물 초고추장 고추장 다진마늘 설탕 다진 청양 고추 대파 흰부분 다진거 참기름 들기름 깨소금 청양 고춧가루 
비빔국수,비빔, 소면 크기만큼 김치 고추장 간장 설탕 식초 참기름 또는 들기름 깨 
김치참치샐러드주먹밥,비빔, 김치 통조림 참치 밥 조미김가루 밥 밑간 소금 참기름 마요네즈 참깨 후춧가루 
비빔밥,비빔, 시금치 콩나물 당근 애호박 새송이버섯 달걀 식용유 소금 후추 참기름 장 고추장 간장 매실액 참기름 
냉이비빔밥,비빔,냉이 비빔밥 밥 당근 호박 당근 냉이 계란 초고추장 콩기름 멸치 액젓 소금 깨소금 참기름 마늘 배추 된장국 배춧잎 대파 청양초 멸치 육수 된장 
멍게비빔밥,비빔, 멍게 상추 오이 당근 새싹 시판초고추장 참기름 다진마늘 올리고당 
골뱅이비빔국수,비빔, 골뱅이캔 상추 당근 새싹 대파 오이 소면 시판초고추장 참기름 다진마늘 올리고당 통깨 솔솔
갑오징어새싹비빔밥,비빔, 갑오징어 새싹채소 콩나물 당근 상추 고추장 간장 꿀 식초 마늘 참기름 
쌈장,비빔, 된장 고춧가루 설탕 대파 청양고추 통깨 참기름 
김치비빔국수,비빔, 김치 소면 양파 애호박 당근 다진마늘 고추장 고춧가루 진간장 설탕 식초 참기름 
소고기비빔면,비빔, 소고기 샤브샤브용 양배추 라면사리 김치 고추장 설탕 식초 다진마늘 작은 간장 참기름 
야채비빔밥,비빔, 콩나물 시금치 애호박 당근 새송이버섯 달걀 간장 참기름 통깨 장 고추장 식초 올리고당 
꼬막비빔밥,비빔, 꼬막 소금 소금 장 간장 설탕 다진마늘 다진파 고춧가루 통깨 참기름 
삼색나물비빔밥,비빔, 밥 우둔살 고기밑간 맛간장 다진마늘 후추 도라지나물 고사리나물 시금치나물 도라지오이초무침 계란 참기름 깨소금 고추장 
스팸무스비,비빔, 삼색나물 밥 계란 김 스팸 치즈 참기름 
나물비빔밥,비빔,나물 비빕밥 잡채 고사리 시금치 도라지나물 밥 배추김치 참치 달걀 식용유 참치 기름 김치 국물 고추장 들기름 통깨 숟가락 기준
멍게비빔밥,비빔,멍게 멍게 어간장 다진마늘 다진파 청양고추 홍고추 매실액 고춧가루 청주 멍게비빔밥 무생채 해초무침 멍게 부추무침 콩나물 무말랭이무침 상추 해초무침 해초 설탕 식초 
LA갈비비빔국수,비빔, 국수 갈비 계란 파 굴소스 간장 설탕 참기름 후추 통깨
시래기비빔장,비빔, 무청시래기 막장 된장 크게 설탕 표고버섯 감자 양파 반개 파 마늘 육수 들기름 참기름 식용유 
쫄면,비빔, 고추장 고춧가루 사과 간장 맛술 올리고당 다진마늘 식초 통깨 참기름 설탕 소금 
숙주나물솥밥,비빔, 밥 숙주 소고기산적 식용유들기름 달래간장 달래 액젓 또는 국간장 맛간장 또는 양조간장 고춧가루 매실액 참기름 통깨 
명란마요덮밥,비빔, 명란젓 마요네즈 미림 와사비 취향껏 쪽파 계란 후추 
과일견과요거트샐러드,비빔, 사과 방울토마토 파인애플 딸기 몇개 오렌지 건포도 호두 플레인요거트 꿀 레몬즙 
콩나물밥,비빔, 돼지고기 썰은 것 정도 콩나물 쌀 간장 물 참기름 다진 마늘 설탕 고춧가루 다진 파 깨소금 
비빔라면,비빔, 라면 대파 삼겹살 고추장 요리당 소금 후추 고춧가루 식용유 
낙지젓갈비빔밥,비빔, 밥 낙지 젓갈 봄동 달래 통깨 참기름 
비빔국수,비빔, 국수 고추장 매실 진액 감식초 묵은지 김가루 깨소금 참기름 햄프씨드 
비빔밥,비빔,필수 콩나물 시금치 애호박 표고버섯 밥 달걀 고추장 참기름 다진 마늘 소금 참기름 통깨 
납작비빔만두,비빔, 당면 왕 만두피 파 맛소금 참기름 빨간 파프리카 양배추 중 장 고추장 설탕 식초 토마토케첩 다진마늘 
고추참치비빔면,비빔, 라면사리 다진마늘 양파 고추장 고추참치 물 종이컵
비빔라면,비빔, 라면 양파 사과 전장김 초고추장 들기름 
돌솥비빔밥,비빔, 애호박 당근 양파 양송이버섯 달걀 밥 고추장 참기름 깨 오일 천일염 통후추 
떡만두강정,비빔, 떡 물만두 튀김용기름 고추장 다진마늘 설탕 물엿 케찹 간장 깨 
쫄면,비빔, 쫄면 양배추 양파 개 깻잎 당근 개 삶은계란 장 고추장 고춧가루 식초 진간장 다진 마늘 다진 파 설탕 간 사과 깨소금 후추 
계란비빔밥,비빔, 밥 오골계 알 간장 깨소금 참기름 
비빔밥,비빔, 밥 보름나물 계란 초고추장 깨소금 참기름 
아보카도명란비빔밥,비빔, 밥 아보카도 명란 조미김 계란 후라이 대파 들기름 
김치비빔국수,비빔,비빔국수 잘 익은 배추김치 소면 파인애플 삶은계란 김가루 고추장 고춧가루 매실청 물엿 양조간장 다진 마늘 참기름 깨소금 김치국물 
당면쫄면,비빔, 당면 상추 깻잎 양배추 당근 작은 사이즈 오이 노란 파프리카 쫄면 장 고추장 케찹 식초 설탕 통깨 
산채비빔밥,비빔,고추잎나물 고춧잎나물 진간장 다진파 마늘 들기름 생들깨가루 식용유 아주까리나물 아주까리 진간장 마늘 다진파 들기름 생들깨가루 식용유 가지나물 가지 진간장 소금 마늘 다진파 깨소금 참기름 올리고당 식용유 취나물 취나물 진간장 다진파 마늘 깨소금 참기름 식용유 호박고지 호박 진간장 마늘 다진파 깨소금 참기름 식용유 고사리 고사리 진간장 마늘 다진파 깨소금 참기름 식용유 후추 약고추장 쇠고기다진것 고추장 올리고당 참기름 
소고기비빔국수,비빔, 소고기 다짐육 양파 다진 마늘 간장 물 설탕 올리고당 생강가루 후추 참기름 통깨 쪽파 소면 또는 중면 고명 오이 취향것 청홍고추 취향것
야채비빔밥,비빔, 양파 애호박 느타리버섯 당근 소금 씩 식용유 씩 통깨 고추장 또는 간장 취향껏 참기름 또는 들기름 취향껏
쫄면,비빔, 쫄면 양배추 오이 콩나물 당근 삶은 달걀 통깨 참기름 취향껏 설탕 식초 사과 갈아서 다진 마늘 고추장 참치 액 장은 대략 정도
참치유부초밥,비빔, 초밥세트 양파 참치 마요네즈 소금 파 
콩나물밥,비빔, 콩나물 불린쌀 돼지고기 맛술 소금 후추 간장 고춧가루 참기름 쪽파 통깨 표고버섯 다시마
비빔만두,비빔, 고추장 고춧가루 식초 설탕 참기름 비빔 양파 당근 오이 깻잎 크래미 맛살 만두 떡만두 
초고추장,비빔, 고추장 설탕 식초 다진생강 다진 마늘 미림 
돌나물밥,비빔, 죽순 돗나물 구운김 죽순 조림장 기름 간장 미림 물엿 설탕 
김치비빔국수,비빔, 국수 식용유 김치 간장 고추장 고춧가루 설탕 올리고당 식초 참기름 통깨 
고추장비빔장,비빔, 고추장 매실액 식초 고춧가루 다진 마늘 들기름 유자청 후추 
콩나물비빔국수,비빔, 양상추 콩나물 양파 다진김치 오이 달걀 소면메밀소바면 사용 장 고추장 고춧가루 어간장 간장 식초 맛술 올리고당 다진마늘 참기름 
꼬막,비빔,왕꼬막무침 왕꼬막통조림 오이 당근 쌈채소 고춧가루 다진마늘 맛간장진간장 매실액 식초 참기름 통깨 왕꼬막무침비빔국수 왕꼬막무침 오이 당근 쌈채소 고춧가루 식초 매실액 맛간장진간장 참기름 통깨 소면 
톳비빔국수,비빔, 소면 먹기 좋은 길이로 손질한 자른 톳 초장 고운 고추가루 다진마늘 매실청 참기름 
쭈꾸미비빔밥,비빔,필수 쭈꾸미 삶은 콩나물 부추 상추 대파 양파 청양고추 식용유 장 고추장 고춧가루 간장 맛술 물엿 매실액 다진마늘 후추 선택 김가루 참기름 
연두부비빔밥,비빔,콩나물 볶음 콩나물 콩기름 굴소스 깨소금 호박볶음 호박 간장 깨소금 참기름 마늘 무나물 무 깨소금 참기름 마늘 소금 표고버섯볶음 표고버섯 간장 깨소금 들기름 마늘 당근볶음 당근 깨소금 참기름 소금 시금치나물 시금치 간장 깨소금 참기름 연두부 비빔밥 만드는 법 연두부 나물 달걀 밥 깨소금 참기름 달래장 
비빔국수,비빔, 소면 김치 고추장 고춧가루 매실액 설탕 들기름 통깨 오이 상추
비빔국수,비빔, 소면 크기 계란 오이 장 김치 고추장 고춧가루 설탕 참기름 간장 
콩나물비빔국수,비빔, 소면 양파 콩나물 신김치 당근 깻잎 삶은계란 비빔장 고추장 식초 다진마늘 맛술 고춧가루 설탕 참기름 데친 콩나물 밑간 다진마늘 소금 
비빔국수,비빔, 소면 상추 깻잎 오이 연근 고추장 식초 설탕 올리고당 간장 레몬즙 참기름 
새싹비빔밥,비빔, 달래 저염간장 참기름 들기름 깨 고춧가루 
에그마요샌드위치,비빔, 삶은 계란 마요네즈 허니머스타드 식빵 슬라이스 치즈 
달래장,비빔, 달래 간장 올리고당 양파 홍고추 고춧가루 통깨 참깨 
멍게비빔밥,비빔,멍게 냉이 비빔밥 멍게 냉이 밥 소금 참기름 깨소금 고추장 고추장 올리고당 식초 깨소금 
고추참치비빔면,비빔, 국수 고추참치캔 작은거 고추장 참기름 통깨 
아보카도명란비빔밥,비빔, 밥 아보카도 명란젓 달걀 재래김 참기름 깨소금 
달래장비빔밥,비빔,달래장비빔밥 달래 느타리버섯 간장 고춧가루 참기름 간 마늘 통깨 밥 다시마 
아보카도명란비빔밥,비빔, 아보카도 로메인 아삭이상추 계란 밥 명란젓 쪽파 참기름 소금 
비빔국수,비빔, 국수 오이 계란 열무김치 참기름 깨소금 초고추장 설탕 식초 
간장비빔국수,비빔, 소면 묵은지 달걀 김가루 통깨 간장 간장 설탕 참기름 
지라시초밥,비빔, 달걀 데친 브로컬리 생표고 자숙새우 소금 정종 당근 무순 연근 초밥초 식초 소금 설탕 미림 달래간장 잘게 자른 달래 간장 물 통깨 식초 
꼬막야채비빔밥,비빔, 꼬막 통조림 오이 상추 당근 양파 풋고추 대파 간 마늘 초고추장 참기름 미소된장국 미소된장 김가루 파 가쓰오부시 
멍게비빔밥,비빔, 멍게 치커리 당근 오이 김가루 초고추장
참나물메밀비빔국수,비빔, 참나물 메밀국수 데친 꼬막 대저토마토 국수 고추장 고춧가루 사과 매실청 대파 다진 마늘 깨소금 참기름 
오징어비빔국수,비빔, 소면 양배추 채썬 것 양파채썬 것 당근채 빨간 파프리카 오이 상추 채썬 것 오징어몸통만 삶은 달걀 등 장 고추장 고운 고추가루 레몬즙 오미자효소 식초 물엿 사과잼 참기름 통깨 
김치비빔국수,비빔, 소면 양파 상추 삶은계란 애호박 당근 참기름 깨소금 다진배추김치 고추장 간장 고춧가루 설탕 매실액기스 
참치마요주먹밥,비빔, 밥 통조림 참치 단무지 김가루 크게 마요네즈 참기름 
골동반,비빔, 소고기 계란 말린표고버섯 당근 세발나물 김가루 쌀 인분 양조간장 마늘 요리당설탕 참기름
날치알유부초밥,비빔, 시판 초밥용 유부 초밥소스 조미 볶음 밥 청피망 빨간 파프리카 꼬들 단무지 날치알 사이다 
쫄면,비빔,필수 탱탱비빔쫄면 양배추 훈제닭가슴살 선택 치커리 삶은달걀 
채식비빔밥,비빔, 조미유부 당근 양파 오이 애호박 건표고버섯 미나리나물 소금 맛간장 달걀 첨가룸 통깨 
김치비빔국수,비빔, 김치 미나리 오이 당근 삶은달걀 표고버섯조림간장 소면 김칫국물 고춧가루 설탕 참기름 통깨 
소고기메밀비빔면,비빔,필수 소고기다짐육 오이 배 메밀면 고기 간장 후추 다진마늘 맛술 설탕 고추장 고춧가루 간장 다진마늘 다진양파 올리고당 참기름 선택 삶은달걀 
김치비빔국수,비빔, 소면 잘게썬 김치와 국물 고추장 정도 설탕 참기름 통깨 
돌솥비빔밥,비빔, 밥 고사리나물 도라지나물 깻잎순나물 무나물 미역줄기볶음 콩나물 숙주나물 계란 김가루 양녑 참기름 통깨 고추장 버터 
간장비빔국수,비빔, 소면 크기 간장 설탕 고추가루 참기름 소금 볶은깨 
현미샐러드,비빔, 현미 모듬채소 오이 라즈베리 올리브유 소금 라즈베리 드레싱 시판 오리엔탈 드레싱 라즈베리 꿀 
비빔쫄면,비빔, 쫄면 콩나물무침 상추 토마토 오이 소금 
무밥,비빔, 쌀 물 채썬 무 마른표고버섯 장 간장 설탕 깨소금 간마늘 고춧가루 잘게 썬 파 참기름 
멍게,비빔,멍게 회 손질 멍게 초고추장 멍게 무침 멍게 청양초 고춧가루 매실진액 감식초 고추장 깨소금 참기름 마늘 봄나물 멍게 비빔밥 밥 당근 세발나물 방풍 취나물 양상추 김가루 깨소금 참기름 초고추장 
채소비빔밥,비빔, 어린잎채소 밥 참치캔 고추장 다진마늘 참기름 깨 
비빔국수,비빔, 중면 계란 겨자채 양상치 당근 참기름 맛간장 홍고추 청량고추 통깨 비빔장 고추장 식초 설탕 매실청 참기름 간장 다진대파 마늘 
파김치비빔밥,비빔, 파김치 참치캔 김가루 계란 참기름 고추장
딸기비빔국수,비빔, 딸기 베이비 채소 소면 매실청 설탕 집간장 소금 참기름 깻가루 
꼬막비빔밥,비빔, 꼬박 캔 밥 청양고추 양파 부추 장 고춧가루 설탕 식초 멸치 액젓 다진 마늘 꼬막 국물 다진 대 파 참기름 통깨 참기름 
꼬막비빔밥,비빔,꼬막 비빔밥 꼬막 통조림 밥 어린잎 채소 쪽파 청양고추 홍고추 간장 맛술 매실액 고춧가루 고추장 식초 참기름 통깨 계량스푼 기준입니다
아보카도명란비빔밥,비빔, 아보카도 명란젓 브로콜리 밥 김가루 참기름 달걀 식용유 소금 
어묵비빔국수,비빔, 국수 어묵 양파 청양고추 홍고추 대파 통깨 고추장 다진 마늘 간장 맛술 올리고 당 참기름 물 
김치비빔국수,비빔, 국수 계란 오이 장 고추장 고춧가루 청양고춧가루 진간장 설탕 
비빔국수,비빔, 필요한 소면 목살 묵은지 오이 달걀 소금 후추 깨 식용유 비빔국수 황금레시피 장 고추장 고춧가루 간장 설탕 다진마늘 김칫국물 참기름 소면삶기 물 추가물 
멍게비빔밥,비빔, 멍게 밥 양배추 당근 오이 상추 치커리 초고추장 고추장 식초 설탕 다진 마늘 참기름 깨소금 
간장비빔국수,비빔, 소면 물 찬물 계란 간장장 간장 맛술 고춧가루 다진마늘 설탕 다진고추 후추 깨 참기름 
멍게낙지비빔밥,비빔, 밥 멍게 낙지 낙지젓 양파 깻잎 상추 마늘 청양고추 김가루 초고추장 참기름 통깨
비빔국수다대기,비빔, 참기름 통깨 마늘 간장 
양푼비빔밥,비빔, 소고기 양파 대파 오이 달걀 모듬쌈채소 고추장 올리고당 참기름 통깨 
콩나물비빔국수,비빔, 소면 콩나물 부추 양파 고춧가루 식초 간장 맛술 올리고 당 설탕 참기름 통깨 
아보카도연어덮밥,비빔, 연어 아보카도 날치알 밥 참기름 소금 장 간장 겨자 참기름 
열무김치말이국수,비빔, 열무물김치 건더기 김치 국물 소면 오이 김치 고추장 고춧가루 설탕 식초 소금 
조개비빔국수,비빔, 국수 채소 골뱅이또는조개류 열무또는배추김치 취향따라 고수 고추장 식초 설탕 다진마늘 
비빔국수,비빔, 국수 식용유 계란 마늘햄 사각 어묵 파프리카빨노랑 오이 깻잎 상추 또는 쌈배추 장 초고추장 고추장 설탕 참기름 깨소금 
비빔칼국수,비빔, 계란 상추 칼국수면 대패삼겹살 고추장 듬뿍 물엿 고춧가루 식초 참기름 설탕 통깨
아보카도비빔밥,비빔, 아보카도 달걀 양파 쌀밥 참기름 깨소금 간장 생수 올리고당 
만두비빔면,비빔,필수 중화비빔면 선택 냉동만두 양배추 당근 달걀 
비빔쫄면,비빔, 쫄면 양배추 오이 당근 파프리카 달걀 참기름 통깨 쫄면 장 고추장 간장 다진 마늘 식초 설탕 사과 
명란젓비빔밥,비빔, 밥 상추 쑥갓 계란 초고추장 명란젓 깨소금 참기름 
버터간장비빔밥,비빔, 밥 달걀 노른자 버터 파 간장
쫄면,비빔,필수 삶은쫄면사리 멸치다시마육수 데친유부 데친어묵 달걀 국간장 소금 후추 고명 쑥갓 송송 썬 대파 김가루 고춧가루 
