CKG_NM,CKG_MTH_ACTO_NM,CKG_MTRL_CN
꼬막비빔밥,비빔, 꼬막 쪽파 청양고추 홍고추 간장 고추가루 맛술 올리고당 마늘 참기름 통깨 
달래간장,비빔, 달래 홍고추 조림간장 설탕 요리당 고추가루 다진마늘 들기름 통깨 
표고버섯비빔밥,비빔, 쌀 바로넣어먹는 건조 표고버섯 진간장 생수 참기름 깨 대파 청양고추없어도 됩니다 
꼬막비빔칼국수,비빔, 꼬막 오이 당근 상추 깻잎 양배추 장 설탕 식초 고추장 다진마늘 참기름 
미나리돌솥비빔밥,비빔, 밥 미나리 무 생채 참기름 
골뱅이비빔면,비빔,필수 비빔면 골뱅이 참기름 기타 삶은달걀 양배추 오이 김가루
사라다,비빔, 옥수수 통조림 맛살 아로니아 논콜 마요네즈 양파과일견과류 자유롭게 
쫄면,비빔, 쫄면 당근 오이 양파 깻잎 달걀 양배추 고추장 고춧가루 식초 설탕 올리고당 매실청 간장 청양고추 참기름 
탄탄비빔면,비빔, 국수 중면 새우 양배추 오이 당근 땅콩버터 설탕 두반장 굴소스 고추장 고추기름 치킨스톡 뜨거운 물 
꼬막비빔밥,비빔, 꼬막 집에 있는 야채들 아무거나 고추장 참기름 볶은깨
비빔국수,비빔, 국수 네개 물 상추 오이 대파 간장 고추장 고추가루 매실 설탕 식초 마늘 참기름 
달래양념장,비빔, 달래 양파 당근 간장 올리고당 고춧가루 참기름 통깨 
쪽파갓김치,비빔, 쪽파 적갓 양파 배 고추가루 새우젓 멸치액젓 올리고당 
메밀막국수,비빔, 막국수 메밀면 오이 사과 양파 삶은 달걀 무쌈 막국수 다데기 동치미 김치 국물 김가루 고추장 고추가루 식초 설탕 생강술 조선간장 다진마늘 
꼬막달래비빔밥,비빔, 참 꼬막 새싹야채 달래 쯔유 멸치액젓 고춧가루참기름양파껍질 밥 들기름
쫄면,비빔, 쫄면 상추 달걀 무 생채 콩나물 삶은것 쫄면 고추장 고운고춧가루 진간장 올리고당 매실청 설탕 식초 마늘 참기름 
누들샐러드,비빔, 파스타면 누들 바질페스토 살라미 햄 파프리카 토마토 양파 작은거 사과 계란 로메인 상추 궈다 치즈 치즈종류 무관 소금 올리브유
꼬막비빔밥,비빔, 꼬막 양파 당근 깻잎 양배추 통깨 액젓 간장 고춧가루 맛술 올리고당 매실청 설탕 참기름 청양고추 다진마늘 대파 
꼬막비빔밥,비빔, 밥 꼬막 계란 당근 양파 깻잎 간장 고추가루 올리고당 설탕 식초 참기름 깨 다진마늘 다진대파 
비빔국수양념장,비빔, 국수 김치 배추 계란 오이 대파 장 간장 고추장 고추가루 설탕 매실청 다진마늘 통깨 참기름 고명 김가루 계란지단 치커리 상추
고구마요거트샐러드,비빔, 고구마 삶은계란 그릭요거트 시나몬가루 소금 아몬드 우유 
참치쌈장,비빔, 참치캔 된장 고추장 고춧가루 요리당 다진양파 다진파 흰부분 다진마늘 다진청양고추 들기름 통깨 물 자박할정도 곁들어먹을쌈야채 양배추 상추 먹을만큼
계란간장밥,비빔, 유정란 밥 쪽파 간장 
간장비빔국수,비빔, 국수 당근 쪽파 애호박 설탕 간장 물 다진마늘 식초 참기름 
비빔야채수육,비빔, 콩나물 무채 볶은 당근 시금치나물 애호박 나물 버섯 고기 수육 초고추장 
쪽파대패삼겹살비빔국수,비빔, 대패 삼겹살 허브솔트 소면 쪽파 초고추장 고추가루 다진마늘 식초 매실청 참기름 통깨 
관자비빔밥,비빔,관자밑간 관자 소금 후추 고추가루 올리고당 다진마늘 참기름 통깨 야채 대파 홍고추 부추 깻잎 
간장계란밥,비빔, 밥 마가린 달걀 맛간장 참기름 통깨
석류야채요거트,비빔, 플레인요거트 석류 토마토 오이 소금 민트나 바질 견과류 설탕 
현미샐러드,비빔, 현미밥 토마토 오이 애호박 피망 루꼴라 견과류 페타 치즈 올리브유 레몬즙 소금 후추 오레가노 넉넉히 다진마늘 설탕 
아보카도명란마요덮밥,비빔, 밥 아보카도 오이 맛살 이외집에있는 참기름 달걀 김가루 명란마요소스 명란젓 마요네즈 고추냉이 
쫄면,비빔, 쫄면 오이 양배추 당근 콩나물 상추 삶은달걀 참기름 장 고추장 고춧가루 식초 간장 설탕 매실액 맛술 사이다 다진마늘 통깨 
단호박샐러드,비빔, 단호박 삶은계란 플레인요거트 계피가루 팬케익 시럽 아몬드 우유 
아보카도명란비빔밥,비빔, 밥 아보카도 명란 김 참기름 쯔유 계란
오리엔탈소스,비빔, 올리브유 간장 식초 올리고당 다진마늘 통깨 후추 
앞다리살비빔국수,비빔, 소면 돼지앞다리살 김치 김 오이 씩
단호박샐러드,비빔, 단호박 플레인요플레 견과류 마요네즈 매실 
비빔당면,비빔, 당면 미나리 사각어묵 단무지 당근 소금 간장 고추장 고춧가루 식초 올리고당 청양고추 설탕 
달래간장,비빔, 달래 진간장 고춧가루 매실청 참기름 깨소금 통깨 
계란고추장비빔밥,비빔, 계란 밥 참치 기름 후라이팬에두를거임 고추장 취향것 들기름 소금 
열무비빔밥,비빔, 열무 절일 굵은소금 양파 홍고추 고춧가루 찹쌀풀 양파 다진마늘 다진생강 새우젓 멸치액젓 설탕 소금물 
대패삼겹살비빔밥,비빔, 대패삼겹살 콩나물 상추 파채 계란 통깨 비빔밥장 고추장 듬뿍 매실액 다진마늘 참기름 사이다 콩나물무침 국간장 소금간 참기름 파절이 파 고춧가루 진간장 식초 설탕 깨소금
머스타드소스,비빔, 마요네즈 꿀 겨자 레몬즙 식초 
만두비빔면,비빔,필수 비빔면 콩나물 만두 통깨 식용유 
비빔밥,비빔, 쌀 멸치액젓 참기름 무 손가락길이 애호박 당근 표고버섯 물 고추장 진간장 참기름 매실액 볶은 깨 다진마늘 
감자계란샌드위치,비빔, 감자 계란 모닝빵 마요네즈 허니머스터드소스 소금 한 꼬집 후추 파슬리 
간장비빔라면,비빔, 라면 물 간장 멸치액젓 설탕 다진마늘 식초 볶은 깨 넉넉히 참기름 
단호박롤샌드위치,비빔, 단호박 빨간파프리카 오이 식빵 원하는 견과류 꿀 허니머스타드 마요네즈 
도시락,비빔, 모닝빵 체다치즈 양상추 방울토마토 양파 냉동 떡갈비 마요네즈 돈까스 소스 김 배추김치 참기름 설탕 흰쌀밥 밥이랑 캔참치 유부초밥 만들기 셋트
참치또띠아샌드위치,비빔, 또띠아 참치캔 빨간 파프리카 오이 양파 콘옥수수 양상추 슬라이스치즈 슬라이스햄 마요네즈 설탕 소금 
시래기비빔장,비빔, 삶은시래기 파 마늘 표고 양파 시래기 삶을때 물 액젓 국간장 시래기 볶을때 된장 고춧가루 들기름 육수 
바질페스토,비빔, 바질 소독용 식초 올리브유 치즈 아몬드 후추 소금 다진마늘 오레가노 
참치마요덮밥,비빔, 밥 캔참치 깻잎 단무지 김밥용 참치 밑간 소금 후추 마요네즈 
참치호박비빔국수,비빔, 캔참치 소면 애호박 양파 당근 어슷썰기로 청양고추 장 고추장 굴소스 진간장 설탕 고춧가루 다진마늘 작은 물 
꼬막비빔밥,비빔, 꼬막살 밥 홍고추 쪽파 간장 고춧가루 들기름 설탕 맛술 깨 다진마늘 
참치마요덮밥,비빔, 밥 참치캔 달걀 김자반 마요네즈 돈까스소스 야간
콘샐러드,비빔, 옥수수캔 종이컵 양파 오이 당근 파프리카 마요네즈 설탕 소금 
김치비빔국수,비빔, 김치 포기 소면 고추가루 깨 참기름 설탕 진간장 
쫄면,비빔, 쫄면 양배추 삶은 콩나물 씩 오이 삶은 달걀 반 개 식초 참기름 통깨 쫄면 장 고춧가루 고추장 간장 올리고당 간 양파 다진 마늘 연겨자 청양고추 밥숟가락 기준입니다
김치말이주먹밥,비빔, 김치 밥 참치 소금 참기름 마요네즈 
상추비빔밥,비빔,쌈장 참치캔 고추장 간장 물엿 토마토케첩 참기름 후추 비빔밥 밥 상추 달걀 참치쌈장 
김치비빔국수,비빔, 국수 김치 고추가루 고추장 매실청 식초 설탕 참기름 깨소금 
참치비빔밥,비빔, 참치 현미밥 깻잎 상추 무순 파프리카 오이 고추장 식초 설탕 
간장기름밥,비빔, 밥 한공기 간장 들기름 참기름 통깨 
봄동비빔밥,비빔, 봄동 달걀 봄동 고춧가루 양조간장 멸치 액젓 다진 마늘 설탕 올리고 당 참기름 통깨 고추장 느타리버섯 양파 청양고추 고추장 참기름 다진 마늘 올리고 당 통깨 선택 김가루
비빔면,비빔, 설탕 식초 고추장 
고추참치밥,비빔, 고추참치 밥 김 깨 
쫄면,비빔, 망고 적양배추 당근 오이 양파 진짜 쫄면 
야채비빔국수,비빔, 골뱅이 국수 오이 양파 당근 파채 양배추 깻잎 장 고추장 고춧가루 설탕 식초 매실액 간장 골뱅이국물 연겨자 참기름 통깨 
비빔만두,비빔, 양배추 당근 대파 김치만두 
쫄면,비빔,필수 진짜 쫄면 생와사비 삶은 달걀 선택 양배추 
김치비빔국수,비빔, 국수 김치 깻잎 오이 당근 청양고추 양파 삶은달걀 김가루 고춧가루 고추장 식초 올리고당 매실청 설탕 참기름 
비빔라면,비빔, 쫄 쫄면 양배추 당근 상추 
김치비빔국수,비빔, 국수 김치 계란 김치국물 설탕 고추장 통깨 참기름
만능쌈장,비빔,만능쌈장 쌈장 시중에 판매하는제품 고춧가루 사이다 마늘 찻수저로 참기름 견과류 다진 거 양파 다진 거 
청포묵탕평채,비빔, 청포묵 버섯 각 파프리카 파프리카 애호박 오이 돼지고기 잡채용 숙주 고기밑간 간장 맛술 참기름 다진마늘 후추 톡톡 청포묵 간장 참기름 설탕 
간장국수,비빔, 애호박 당근 파프리카 파 상추 간장소스 간장 다진마늘 설탕 식초 깨소금 물 
야채비빔밥,비빔, 시금치 당근 버섯 계란 애호박 콩나물 간장 고추장 들기름
비빔냉면,비빔, 냉면 사리 달걀 소고기 양상추 빨강피망 초절임 무 비빔장 간장 설탕 미향 각 깨소금 톡톡
비빔국수,비빔, 라면사리 양파 씻은 묵은지 오이 다진파 간장 설탕 참기름 다진마늘 식초 통깨 넉넉히 소금 고춧가루 
쫄쫄면,비빔, 도토리 쫄쫄면 달래 맛살 찐 달걀 
김치말이물국수,비빔, 매실청 고추장 고춧가루 식초 통깨 설탕 물김치육수 볶음김치 국수 
초장비빔면,비빔,필수 미역듬뿍초장 비빔면 선택 달걀 당근 건미역 주꾸미
무밥,비빔, 무 세송이버섯 장 간장 깨 참기름 파 고춧가루 설탕 다진마늘 
콩나물밥,비빔, 콩나물 
꼬막비빔밥,비빔, 새꼬막 간장 맛술 참기름 고춧가루 양배추 송송 썬 대파 삶은달걀 깨 밥 소금 여분의 맛술 소금물 
꼬막비빔밥,비빔, 왕 꼬막 멜젓 밥 콩나물무침 푸짐하게 호박나물 오이나물 무말랭이 참기름 통깨 달걀 
아보카도명란마요덮밥,비빔, 아보카도 ½개 명란젓 밥 개인취향 후리가케 참기름 간장 마요네즈 
쫄쫄면,비빔, 쫄쫄면 고추장무말랭이무침 오이 당근 알배기배추 민들레 겉절이 삶은달걀 참기름 통깨 
무채김치비빔국수,비빔, 초석잠 무채김치 고추가루 깨 참기름 진간장 
돌나물비빔밥,비빔, 돌나물 양배추 상추 오이 고추장 고춧가루 다진마늘 식초 매실액 설탕 통깨 
쫄쫄면,비빔, 농심도토리쫄쫄면 각종채소 튀김만두 차돌박이 만두피 삶은달걀
쫄쫄면,비빔, 도토리쫄쫄면 도토리묵말랭이 오이 양배추 썰은것 깻잎 상추 
비빔국수,비빔, 소면 삶은 계란 오이 양배추 고추장 매실청 진간장 설탕 식초 통깨 
비빔만두,비빔, 도토리 쫄쫄면 고기만두 양배추 당근 오이 
쫄쫄면,비빔, 농심 도토리 쫄쫄면 오이 당근 삶은계란 양배추 
쫄쫄면,비빔, 얼음 항정살 
쫄쫄면,비빔, 라면 오이 당근 얼갈이 열무 달걀 
쫄쫄면,비빔, 도토리쫄쫄면 삼겹살 오이 골뱅이 샐러드채소 
꼬막비빔모밀면,비빔, 모밀면 오이 사과 파프리카 양파 양배추 양상추 꼬막 깨 비빔소스 고추장 고춧가루 진간장 매실액 설탕 식초 참기름 다진마늘 
유자소스,비빔, 유자청 레몬쥬스 
크래미샌드위치,비빔, 우유식빵 크래미 양파 마요네즈 코울슬로드레싱 올리고당 티스푼으로 
열무비빔국수,비빔, 국수 열무김치 계란 고추장 설탕 통깨 참기름
꼬막비빔밥,비빔, 꼬막 무순 당근 오이 등 각종야채 꼬막장 진간장 국간장 참기름 설탕 매실액 다진마늘 쪽파 다진고추 통깨
삼치비빔라면,비빔, 손질된 삼치 양파 월계수잎간장 올리고당 후추 톡 생강즙 맛술 물 삼치비린내제거하기 소주 후추 톡톡 레몬즙 
비빔면,비빔, 비빔면 브랏비엔나 김가루 땡초들기름 통깨 솔솔 김치 
양배추샌드위치,비빔, 분량 곡물 식빵 양배추 채썬것 마요네즈 꿀 레몬즙 후추 오이피클 손가락 크기 달걀 슬라이스 치즈 빵에 바를 소스 홀그레인 머스터드 마요네즈 꿀 
김치비빔국수,비빔, 소면 신김치 호박 당근 파 씩 식용유 간장 설탕 사과식초 고춧가루 다진 마늘 참기름 깨소금 
쇠고기비빔밥,비빔, 소고기 양파 큰거 하나 애호박 하나 팽이버섯 달걀 깻잎 고추장 맛간장 진간장 맛술 매실액 식초 올리고당 고추기름 깨소금 
막국수,비빔, 고춧가루 설탕 식초 고추장 다진파 다진마늘 참기름 참깨 무 시판 냉면 육수 오이 메밀국수 삶은 달걀 소금 설탕 달걀 
두부참치쌈장,비빔, 두부 참치캔 된장 고추장 다진마늘 요리당 땅콩소스 들기름 통깨 
장조림버터비빔밥,비빔, 햇반 마가린 시판 장조림 계란 쪽파 소금 
쫄면,비빔, 쫄면 삶은 콩나물 채썬 양배추 채썬당근 채썬 오이 적당 삶은달걀 식초 장 고춧가루 설탕 식초 매실액 물 고추장 간장 참기름 다진마늘 통깨 고추냉이 
콩나물비빔밥,비빔, 콩나물 당근 오이 물 간장 고춧가루 설탕 참기름 통깨 청양홍고추 청양청고추
지라시스시,비빔, 밥 단촛물 오이 달걀 연어통조림 크래미 후리가케 소금 단촛물 소금 설탕 
소불고기비빔밥,비빔, 당근 오이 불고기 양파 달걀 상추 볶음고추장 들기름 소금 
자몽샐러드,비빔, 올리브유 양조간장 올리고당 소금 후춧가루 자몽 아보카도 어린잎채소 
계란노른자장,비빔, 계란 간장 깨소금 참기름
쫄면,비빔,필수 와사비 진짜쫄면 교자 
김치비빔국수,비빔, 참기름 참깨 설탕 고추장 참기름 신김치 삶은달걀 야채 소면 
참치쌈장,비빔, 참치캔 큰거 대파 양파 물 고추장 쌈장 고춧가루 간 마늘 청양고추 상추 밥
냉면비빔장,비빔, 다진마늘 고추가루 고추장아찌물 매실액 간장 식초 사양꿀 해찬들태양초골드고추장 
고추장,비빔, 고춧가루 메주가루 띄운밀 요리당 소금 소주 
상추비빔밥,비빔, 꽃 상추 명란젓 밥 달걀 쪽파 참기름 간장 설탕 고춧가루 멸치액젓 참기름 깨소금 
열무비빔막국수,비빔, 메밀국수 열무김치 계란 고추장 매실청 다진마늘 설탕 깨 참기름 
멍게비빔밥,비빔, 밥 멍게 새싹채소 오이 초고추장 참기름 레몬즙
간장비빔국수,비빔, 소면 애호박 당근 진간장 설탕 식초 다진마늘 참기름 통깨 물 
냉면,비빔, 국수 냉면 육수 삶은계란 무초절임 돼지고기 장 고추장 고춧가루 진간장 요리당 다진마늘 참기름 통깨 
김치비빔국수,비빔, 김치 상추 소면 계란 고춧가루 고추장 통깨 설탕 오이 참기름
비빔국수,비빔, 국수 중면 상추 당근 계란 비빔국수 장 고추장 고춧가루 간장 설탕 올리고당 다진마늘 식초 참기름 
주먹밥,비빔,필수 밥 김 슬라이스치즈 참치통조림 마요네즈 소금 후추 크래미 밑간 소금 참기름 
강된장비빔밥,비빔, 밥 계란 고사리나물 등등 강된장 깨소금 참기름 
계란밥,비빔, 밥 계란 식용유 장 
김초장비빔면,비빔, 조미김 라면 물 초장 참기름 청양고추 오이 
장아찌비빔당면,비빔, 당면 무 장아찌 당근 파 시금치 진간장 설탕 고추가루 식초 통깨 참기름 
김초장비빔면,비빔, 조미김 라면 물 청양고추 오이 초장 참기름 
감태명란주먹밥,비빔,필수 밥 감태 명란젓 마요네즈 설탕 밑간 소금 참기름 통깨 
김치비빔국수,비빔, 묵은지 소면 김가루 식용유 간장 들기름 넉넉히 깨소금 
치킨마요삼각김밥,비빔, 김밥용김 남은치킨 밥 마요네즈 
멍게미소비빔면,비빔, 멍게 소면 토핑 미나리 양파 당근 고추 참깨 들기름 고추장 미소된장 다진마늘 와사비 매실청 식초 
날치알주먹밥,비빔, 날치알 밥 당근 단무지 조미김 참기름 마요네즈 맛소금 맛술
꼬막비빔밥,비빔, 손질 꼬막 채썬 파 고춧가루 간장 설탕 맛술 식초 다진마늘 다진부추 
관자새우콜드파스타,비빔, 푸실리 버터 관자 새우 샐러드용 채소 양파 파마산 치즈 소금 후추 소스 올리브유 간장 식초 설탕 다진마늘 레몬즙 
채소비빔밥,비빔,두부된장 채소비빔밥 현미밥 느타리버섯 당근 파프리카 연근 두부 된장 다진 호두 들기름 다진 양파 샐러드 오이 당근 양상추 호두 발사믹 식초 올리브 오일 
낫또비빔밥,비빔, 낫또 간장 겨자 무 달걀 노른자 쪽파 밥 간장 기호껏
쫄면,비빔, 쫄면사리 콩나물 상추 깻잎 양배추 당근 계란 통깨 쫄면장 고추장 고춧가루 식초 설탕 매실액 양조간장 참기름 다진마늘 
회덮밥,비빔, 회 적양파 상추 쑥갓 김가루 양배추 초고추장 들기름 통깨 
참치샌드위치,비빔, 참치캔 오이 양파 식빵 또는 샌드위치용 빵 마요네즈 굵은소금 소금 후추 
닭고기비빔당면,비빔, 닭고기 당면 오이 표고버섯 계란 당근 참나물 식용유 닭 삶기 양파 월계수잎 대파 마늘 후추 맛술 닭고기 밑간 간장 맛술 다진마늘 황설탕 참기름 후추 표고버섯 밑간 간장 참기름 후추 비빔 장 간장 고춧가루 다진마늘 황설탕 식초 참기름 깨소금 
열무비빔국수,비빔, 국수 열무김치 열무김치 파프리카 삶은계란 고추장 고춧가루 설탕 참기름 통깨
국수양념장,비빔, 국수면 비빔국수 고추장 다진마늘 매실청 맛간장 요리당 참기름 설탕 식초 땅콩분태 잔치국수 진간장 고춧가루 다진마늘 대파 청양고추 통깨 간장비빔국수 진간장 고춧가루 청양고추 식초 요리당 참기름 오이냉국수 오이 양파 당근 진간장 고춧가루 다진마늘 매실청 다진 청양고추 식초 통깨 김치말이국수 다진 김치 설탕 다진마늘 참기름 냉면 육수 김치국물 요리당 
참치치즈뚝배기밥,비빔,필수 다진 김치 통조림 참치 마요네즈 통조림옥수수 밥 피자치즈 참기름 식용유 소스 토마토소스 고추장 고춧가루 
해파리냉우동,비빔, 해파리 양파 맛살 파 우동면 연겨자 식초 설탕 다진마늘 물 
간장비빔국수,비빔, 당근 애호박 소면 간장 설탕 식초 다진마늘 참기름 깨소금 
멍게비빔밥,비빔, 손질 멍게 돌나물 당근 참기름 깨소금 초고추장 고추장 매실청 식초 맛술 올리고당 흑설탕 레몬즙 
새우마요덮밥,비빔, 새우 다진양파 다진오이 계란 자반김 마요네즈 굴소스 와사비 맛술 후추 아주 맛술 
마파새우,비빔, 새우 다진돼지고기 파 작은것한개 마늘 굴소스 고추장 된장 맛술 고추가루 물 
베이컨비빔국수,비빔, 프라임 베이컨 소면 묵은김치 달걀 김치국물 고추장 간장 올리고당 들기름 깨 
감자샐러드모닝빵,비빔, 감자 구운 계란 크림치즈 상추 모닝빵 크래미 소금 설탕 파슬리가루 꿀 후추가루 
비빔국수,비빔, 소면 오이 신김치 삶은달걀 고추장 고추가루 설탕 간장 식초 참기름 깨 
새싹오징어비빔밥,비빔, 오징어 새싹채소 흰쌀밥 만능오징어비빔장 고추장 매실청 간마늘 깨 다진김치 참기름 
바지락비빔밥,비빔,비빔밥 바지락 방풍나물 무침 참나물 무침 시금치 무침 콩나물 무침 느타리버섯 볶음 빨강파프리카 주황파프리카 청주 밥 통깨 참기름 비빔고추장 고추장 매실청 꿀 설탕 참기름 통깨 다진마늘 
해초골빔면,비빔, 비빔면 골뱅이 건모듬해초 통참깨 
스팸계란밥,비빔, 스팸 달걀 김가루 날치알 단무지 간장 참기름 
아보카도달걀비빔밥,비빔, 아보카도 달걀 밥 김가루 통깨 소스 물 간장 맛술 올리고당 생강가루 
두부야채비빔밥,비빔, 두부 당근 양파 표고버섯 샐러드 야채 소금 
연어덮밥,비빔, 달걀 양파 상추 토마토 흑임자 드레싱 식초 연어 
김치비빔국수,비빔, 소면 김치 고춧가루 계란 설탕 소금 참기름 오이 
비빔냉면,비빔, 냉면 달걀 오이 양파 사과 깻잎 냉면 고추장 고추가루 설탕 다진마늘 간장 식초 액젓 참기름 
야채비빔만두,비빔, 만두 양배추 고춧가루 고추장 설탕 식초 통깨
인삼사라다,비빔, 인삼 게맛살 양파 완두콩 아보카도 마요네즈 
오이크래미유부초밥,비빔, 유부 오이 크래미 소금 밥 크래미 머스타드소스 설탕 후추 톡톡톡
우렁쌈장비빔밥,비빔, 양파 당근 소불고기 호박 건표고버섯 콩나물 무침 취향에따라 달걀후라이 참기름 통깨 우렁 쌈장 상추 
비빔면,비빔, 당근 호박 표고버섯 달걀 비빔면 소불고기 비빔 장 
비빔국수,비빔, 소면 양파 익은 김치 초장 식초 설탕 들기름 통깨 
쫄면비빔만두,비빔, 만두 양배추 깻잎 쫄면 설탕 고춧가루 식초 간장 올리고당 다진마늘 고추장 참기름 깨 식용유
푸실리파스타,비빔,고추장 고추장 고춧가루 참기름 설탕 매실청 간장 식초 레몬즙 캔 골뱅이 국물 오이 사과 닭가슴살 캔골뱅이 인삼 대추 푸실리 참깨 
간장비빔국수,비빔, 오색 소면 당근 애호박 비빔 설탕 간장 물 간마늘 식초 참기름 깨소금 
열무비빔국수,비빔,필수 소면 오이 삶은 달걀 열무김치 통깨 참기름 고추장 설탕 고춧가루 식초 매실액 올리고당 다진 마늘 김칫국물 
치킨마요,비빔, 밥 치킨 너겟 계란 양파 소스 간장 맛술 올리고당 후추 돈까스소스 마요네즈 식용유
치킨포테이토샐러드,비빔, 냉동 감자 치킨 텐더 모둠 샐러드채소 방울토마토 오이 폰타나알리올리 레몬 드레싱 파슬리가루 
비빔만두,비빔, 골뱅이 양배추 당근 교자 만두 토마토 깻잎 올리브유 시판 초장 기호에따라 고추장 식초 참기름 물엿 매실액 
어묵비빔당면,비빔, 얇은 사각 어묵 상추 양파 당근 식용유 대파흰부분 소금 후추 당면 간장 국간장 참기름 매실청 올리고당 고운고추가루 갈은깨 
인삼성게비빔밥,비빔, 성게알 김가루 깨소금 꿀 인삼 불린쌀 현미 설탕 소금 다진마늘 노랑파프리카 빨강파프리카 부추 당근 양파 어린잎 날치알 김가루 성게알 깨소금 
불닭주먹밥,비빔, 밥 캔참치 핵불닭 소스 마요네즈 참기름 
열무비빔국수,비빔, 열무김치 양상추 오이 소면 장 고추장 설탕 고춧가루 식초 매실액 올리고당 다진마늘 김칫국물 참기름 
문어,비빔, 인삼 문어 무 양파 새싹나물 플레인 요거트 올리브유 티스푼 설탕 티스푼 소금 티스푼
참송이밥,비빔, 쌀 참송이버섯 간장 고추가루 골 파 소량 깨소금 참기름 
성게비빔밥,비빔, 성게 양배추 베이비채소 상추 당근 조미김 참기름 간장 통깨 
돈까스비빔면,비빔, 비빔면 냉면 육수 삶은계란 돈까스 참기름 사이다 
크래미치즈샌드위치,비빔, 빵 치즈 치커리 크래미 방울토마토 마요네즈 허니머스타드 
들기름국수,비빔,필수 소면 소금 깻잎 김가루 들기름 초고추장 고추장 설탕 다진 마늘 식초 들기름 통깨 
비빔냉면,비빔, 냉면사리 삶은계란 오이 고추장 다진마늘 매실청 간장 식초 올리고당 참기름 설탕 깨소금 
회덮밥,비빔, 밥 광어 회 깻잎 청양고추 마늘 새싹 오이 무순 날치알 김가루 초고추장 통깨 참기름
아보카도계란간장비빔밥,비빔, 아보카도 계란 상추 조미 김가루 간장 참기름 통깨 밥 
오트밀,비빔, 양상추 대저 토마토 적양파 시판 요거트 납작 치즈 호두 아몬드 오트밀 꿀 녹차티백 
비빔국수,비빔, 돼지목살 소고기국거리 쏭쏭 썬 대파 흰부분 양파 간장 청주 설탕 올리고당 마늘 생강 사과즙 후추 고운 고추가루 
열무김치비빔국수,비빔, 열무얼갈이 김치 열무김치 국물 고추장 참기름 쪽파 오이 통깨 삶은 달걀 각얼음 
비빔국수장,비빔, 다진양파 다진돼지고기 대파 물 맛술 조청 간장 설탕 사과즙 생강가루 다진마늘 고춧가루 후추 
